{
  "capability_id": "distribution-admission",
  "error_count": 0,
  "expected_failure_count": 0,
  "failure_count": 0,
  "fully_qualified_name": "pmorg.tests.test_distribution_admission.TestDistributionAdmission.test_round_trip_reconstructs_subset_and_allows_publish",
  "implementation_path_set_hash": "sha256:e521d1cbc6e58dd14b7589dcad69aa3d0e7b2befe97160907eda823d0eb53680",
  "patch_ledger_set_hash": "sha256:04c6b40da92e97770e65a0d19c2a6ddcfd0e1cf1dcda222841e5c47cfd217e96",
  "runtime_identity_digest": "sha256:d995d73a0c69b77d30ef0f2b3747a86d85a71111cb15fc805ac838abbac72053",
  "runtime_measurement": {
    "declared_artifacts": [
      {
        "digest": "sha256:02e735b3dfe1c32833eb550b7ff8ffa17f5f2bc3fa1e7bae61a8f5a3883ce398",
        "relative_path": ".python-version"
      },
      {
        "digest": "sha256:0d94ec86320a53e5135fb48e120cfd85ee3964884dd499c8c842b53b13177876",
        "relative_path": "pyproject.toml"
      },
      {
        "digest": "sha256:47fae521b821b6b917699171779c582f3c722536eeb5b5729cef5525e913c708",
        "relative_path": "uv.lock"
      }
    ],
    "interpreter_binary": {
      "digest": "sha256:9efb620bf4def9da93c66480431bf9ca479f5ca495da94483cf9117dd58430bf",
      "relative_path": "@runtime/executed-python-interpreter"
    }
  },
  "schema_version": "pmorg.post-disposition-test-result/v1",
  "skipped_count": 0,
  "test_id": "distribution-admission::test_round_trip_reconstructs_subset_and_allows_publish",
  "test_manifest_digest": "sha256:3e376d538405def2f0a314967d05a6c0e68d30f8de85a3356e0b49aa71d2445e",
  "tests_run": 1,
  "unexpected_success_count": 0,
  "verdict": "pass"
}
